key,value,reference value,description
static.email_template_setting.portal_notes,"Peržiūrėkite mokėjimus, atnaujinkite juos arba tvarkykite savo sąskaitą klientų portale.","View payments, update them or manage your account on your customer portal.
",Portal Notes for the Email Template Setting
static.email_template_setting.footer_notes,"<p> <b> PS: </b> Tikimės, kad jums patiks mūsų patirtis! Kaip visada, nedvejodami kreipkitės į mus. Norėtume išgirsti iš jūsų. </p>","<p><b>PS:</b> We hope you're enjoying your experience with us! As always, feel free to reach out to us. We'd love to hear from you.</p>
",Footer Notes for the Email Template Setting
static.email_template_setting.portal_link_text,Prisijunkite prie savo paskyros dabar ->,"Log into your account now &rarr;
",Portal Link Text for the Email Template Setting
