key,value,reference value,description
sub_start_outside_plan_term,Abonnemangets startdatum kan inte vara före faktureringsperioden.,Subscription start date cannot be before the billing period.,Subscription start date cannot be before the billing period.
old_operation_failed,{0},{0},{0}
subscription.invalid_scheduled_date,kan inte vara efter cancelled_at date ({0}).,cannot be after cancelled_at date ({0}).,cannot be after cancelled_at date ({0}).
line_discount_load_err,Problem med rabatter. Kontakta support för mer information.,Problem with discounts. Please contact support for further details.,Problem with discounts. Please contact support for further details.
trial_end_before_start_date,Provslut kan inte vara före startdatum,Trial end cannot be before start date,Trial end cannot be before start date
scheduled_for_cancellation,Prenumerationen kan inte uppdateras eftersom den är planerad att sägas upp i slutet av nuvarande mandatperiod,Subscription cannot be updated as it is scheduled for cancellation at end of current term,Subscription cannot be updated as it is scheduled for cancellation at end of current term
invalid_state_for_update,Prenumerationen kan endast uppdateras i test- och aktiva tillstånd,Subscription can be updated only in Trial & Active states,Subscription can be updated only in Trial & Active states
required_input_for_status,kan inte vara tomt för {0} prenumeration,cannot be blank for {0} subscription,cannot be blank for {0} subscription
pause-subscription.cancel_end_of_term_not_supported,Det går inte att schemalägga avbokning om prenumerationen är pausad eller planerad att pausa.,Cannot schedule cancellation if subscription is paused or scheduled to pause.,Cannot schedule cancellation if subscription is paused or scheduled to pause.
direct_debit_require_field_validation,{0} är obligatoriskt att använda {1} direktdebitering via {2},{0} is mandatory to use {1} Direct Debit via {2},{0} is mandatory to use {1} Direct Debit via {2}
addon_not_applicable,{0},{0},Plan billing period and addon billing period are incompatible
card_already_exists,{0},{0},{0}
no_charge_item_present,Minst ett engångs tilläggs- eller avgiftsobjekt bör vara närvarande,Atleast one non recurring addon or charge item should be present,Atleast one non recurring addon or charge item should be present
tmp_token_not_supported,Kort tillfälligt token-tillvägagångssätt stöds inte för denna gateway,Card temporary token approach not supported for this gateway,Card temporary token approach not supported for this gateway
non_compliant_eu_customer,Åtgärden misslyckades eftersom eu-landet som anges i faktureringsadress av kund inte kan verifieras mot IP-adress eller kortfacknummer.,Operation failed as the eu country entered in billing address by customer cannot be verified against ip address or card bin number.,Operation failed as the eu country entered in billing address by customer cannot be verified against ip address or card bin number.
resume-subscription.no_payment_method_for_resumption,Det går inte att återuppta prenumerationen eftersom du inte har en aktiv betalningsmetod.,Cannot resume subscription as you do not have an active payment method.,Cannot resume subscription as you do not have an active payment method.
no_creditcard_for_create,Det går inte att skapa prenumerationen eftersom det inte finns något giltigt kort i filen,Cannot create the subscription as there is no valid card on file,Cannot create the subscription as there is no valid card on file
invalid_state_for_cancel,Det går inte att säga upp en prenumeration som redan har avslutats eller upphört att gälla,Cannot cancel a subscription that is Cancelled or Expired already,Cannot cancel a subscription that is Cancelled or Expired already
invalid_state_for_collect,Den här åtgärden stöds endast för en eller flera fakturor i betalningsfördröjning / inte_betald status,This operation is supported only for the invoices in payment_due/not_paid status,This operation is supported only for the invoices in payment_due/not_paid status
resume-subscription.invalid_resume_date,kan inte vara på eller före pausdatum ({0}).,cannot be on or before pause_date ({0}).,cannot be on or before pause_date ({0}).
charge_failed,Inbetalningen misslyckades. Orsak: {0},Payment collection failed. Reason: {0},Payment collection failed. Reason: {0}
charge_item_not_supported_eot,Avgiften kan inte läggas till i en prenumeration som ändras i slutet av termin.,Charge item cannot be added to a subscription changing at end of term.,Charge item cannot be added to a subscription changing at end of term.
charge_item_not_supported,Avgiften kan inte läggas till nu eftersom fakturan inte höjs omedelbart.,Charge item cannot be added now as invoice is not raised immediately.,Charge item cannot be added now as invoice is not raised immediately.
invalid_term_end_date,Datumet bör inte vara före idag,The date should not be prior to today,The date should not be prior to today
no_scheduled_changes,Inga ändringar planeras för denna prenumeration.,No changes are scheduled for this subscription.,No changes scheduled for the subscription on next renewal
date_outside_plan_term,{0} måste vara inom faktureringsperioden,{0} must be within the billing period,{0} must be within the billing period
self_site_change_sub_error,Det går inte att ändra prenumerationen till den angivna planen eftersom den totala nettoomsättningen passerar det fria tröskelbeloppet,Cannot change the subscription to specified plan as total net revenue crosses the free threshold amount,Cannot change the subscription to specified plan as total net revenue crosses the free threshold amount
no_creditcard_for_charge,Laddningen misslyckades eftersom det inte finns något giltigt kort i filen,Charge operation failed as there is no valid card on file,Charge operation failed as there is no valid card on file
self_site_change_sub_feature_error,Det går inte att ändra prenumerationen eftersom den här prenumerationen har funktioner aktiverade som inte är tillgängliga i den nya planen,Cannot change subscription because this subscription has features enabled that are unavailable in the new plan,Cannot change subscription because this subscription has features enabled that are unavailable in the new plan
non_compliant_customer,Åtgärden misslyckades eftersom det land som anges i faktureringsadressen av kunden inte kan verifieras mot IP-adress eller kortfacknummer.,Operation failed as the country entered in billing address by customer cannot be verified against ip address or card bin number.,Operation failed as the country entered in billing address by customer cannot be verified against ip address or card bin number.
quantity_not_allowed,Det går inte att skicka prenumerationsmängden som planen - {0} tillåter inte kvantitet.,Cannot pass subscription quantity as the plan - {0} does not allow quantity.,Cannot pass subscription quantity as the plan - {0} does not allow quantity.
param_must_be_future_date,måste vara ett framtida datum.,must be a future date.,The parameter value must be a future date.
self_site_coupon_error,En speciell kupong har redan tillämpats för denna prenumeration.,A special coupon has already been applied for this subscription.,A special coupon has already been applied for this subscription.
not_scheduled_for_cancellation,Åtgärden misslyckades eftersom prenumerationen inte är planerad för avbokning.,Operation failed as subscription is not scheduled for cancellation.,Operation failed as subscription is not scheduled for cancellation.
hp_card_err,{0},{0},{0}
reactivate_not_supported,Återaktivera operation som inte stöds eftersom övergång till test från icke-förnyande tillstånd inte är möjlig,Reactivate operation not supported as transition to trial from non-renewing state is not possible,Reactivate operation not supported as transition to trial from non-renewing state is not possible
invalid_state_for_reactivate,Prenumerationen måste antingen avbrytas eller förnyas för att återaktiveras,Subscription must be either Cancelled or Non Renewing to reactivate,Subscription must be either Cancelled or Non Renewing to reactivate
update_operation_failed,{0},{0},{0}
change_term_end_not_supported,Den här åtgärden stöds endast för in_trial / active / non_renewing-prenumerationer,This operation is supported only for in_trial/active/non_renewing subscriptions,This operation is supported only for in_trial/active/non_renewing subscriptions
three_d_secure_needed,Åtgärd stöds inte eftersom säker 3D-verifiering krävs för detta kort,Operation not supported as 3D secure verification is needed for this card,Operation not supported as 3D secure verification is needed for this card
invalid_input_for_status,{0} ska inte skickas till {1} ​​prenumeration,{0} should not be passed for {1} subscription,{0} should not be passed for {1} subscription
update_card_error,Problem vid uppdatering av betalningsmetod. Felmeddelande: {0},Problem while updating the payment method. Error message : {0},Problem while updating the payment method. Error message : {0}
invalid_payment_method,Ogiltig betalningsmetod,Invalid payment method,Invalid payment method
subscription.param_should_not_be_sent,Den här parametern ska inte skickas eftersom Auto Collection är PÅ för den här kunden.,This param should not be sent since Auto Collection is ON for this customer.,The parameter should not be sent.
payment_error_during_create,Prenumeration kan inte skapas eftersom vi inte kan samla in {0} från ditt kort. Felmeddelande: {1},Subscription cannot be created as we are not able to collect {0} from your card on file. Error message: {1},Subscription cannot be created as we are not able to collect {0} from your card on file. Error message: {1}
payment_failure_during_reactivate,Prenumerationen kan inte återaktiveras eftersom vi inte kan samla in {0} från ditt arkiva kort. Felmeddelande: {1},Subscription cannot be re-activated as we are not able to collect {0} from your card on file. Error message: {1},Subscription cannot be re-activated as we are not able to collect {0} from your card on file. Error message: {1}
invalid_card_number,Ogiltigt kortnummer.,Invalid card number.,Invalid card number.
resume-subscription.payment_failure_during_resumption,Det går inte att återuppta prenumerationen eftersom vi inte kan hantera betalningen av {0} från din betalningsmetod.,Cannot resume subscription as we are unable to process payment of {0} from your payment method.,Cannot resume subscription as we are unable to process payment of {0} from your payment method.
proration_currency_mismatch,Åtgärden kan inte utföras eftersom de aktuella löptidsfakturorna har en annan valuta än prenumerationen. Kontakta support.,Operation cannot be performed as the current term invoice(s) have different currency from the subscription. Please contact support.,Operation cannot be performed as the current term invoice(s) have different currency from the subscription. Please contact support.
non_compliant_customer_msg,Denna kunds plats kunde inte valideras i enlighet med {0} reglerna. Prenumerationer för denna kund kommer att annulleras vid förnyelse om informationen inte krävs.,This customer''s location couldn''t be validated as required by the {0} rules. Subscriptions for this customer will be canceled upon renewal if the required information is not updated.,This customer''s location couldn''t be validated as required by the {0} rules. Subscriptions for this customer will be canceled upon renewal if the required information is not updated.
prepaid_card_error,{0},{0},{0}
no_creditcard_for_regenerate_invoice,Det går inte att återskapa en faktura eftersom det inte finns något giltigt kort,Cannot regenerate an invoice as there is no valid card on file,Cannot regenerate an invoice as there is no valid card on file
payment_error_during_update,Prenumerationen kan inte uppdateras eftersom vi inte kan samla in {0} från ditt arkiva kort. Felmeddelande: {1},Subscription cannot be updated as we are not able to collect {0} from your card on file. Error message: {1},Subscription cannot be updated as we are not able to collect {0} from your card on file. Error message: {1}
no_creditcard_for_update,Det går inte att ändra prenumerationen eftersom det inte finns något giltigt kort i filen,Cannot change the subscription as there is no valid card on file,Cannot change the subscription as there is no valid card on file
hp_non_compliant_customer,Vi kunde tyvärr inte behandla den här transaktionen eftersom vi inte kunde verifiera din plats. Använd ett kreditkort som utfärdats från samma land som anges i faktureringsinformationen.,"Sorry, we were unable to process this transaction because we could not verify your location. Please use a credit card issued from the same country as provided in the billing information.","Sorry, we were unable to process this transaction because we could not verify your location. Please use a credit card issued from the same country as provided in the billing information."
tmp_tok_card_not_supported,Kortparametrar ska inte skickas med {0},Card params should not be passed with {0},Card params should not be passed with {0}
add_card_error,Problem med att lägga till betalningsmetod. Felmeddelande: {0},Problem while adding the payment method. Error message : {0},Problem while adding the payment method. Error message : {0}
invalid_input_for_status_gifts,{0} ska inte skickas för {1} gåvor,{0} should not be passed for {1} gifts,{0} should not be passed for {1} gifts
rec_addon_not_applicable,Tillägg {0} kan inte tillämpas eftersom endast engångstillägg stöds,Addon {0} cannot be applied as only non-recurring addons are supported,Recurring addon not supported
non_compliant_customer_sub_msg,Den här prenumerationen har avbrutits eftersom vi inte kunde validera kundens plats så som krävs för att följa {0} reglerna.,"This subscription has been canceled, because we were unable to validate the customer''s location as required for compliance with the {0} rules.","This subscription has been canceled, because we were unable to validate the customer''s location as required for compliance with the {0} rules."
no_creditcard_for_reactivate,Det går inte att återaktivera prenumerationen eftersom det inte finns något aktivt kort i filen,Cannot re-activate subscription as there is no active card on file,Cannot re-activate subscription as there is no active card on file
