key,value,reference value,description
quotes.tax_details.label,Szczegóły podatku,Tax Details,Tax applicabality information header shown in quote document
quotes.tax_details.show_tax.exclusive_info,"Należy pamiętać, że obowiązujące podatki mogą ulec zmianie w zależności od daty i adresu rozliczenia w momencie wystawiania faktury.",Please note that taxes applicable may change based on billing date and address at the time of invoicing.,Disclaimer message shown when taxes are added in quotes in exlc mode
quotes.tax_details.no_tax.inclusive_info,Ceny zawierają podatki. Możesz zobaczyć ulgę podatkową po podniesieniu faktury.,Prices are inclusive of taxes. You can view the tax breakup when the invoice is raised.,Disclaimer when taxes are not shown but applicable when invoicing
quotes.tax_details.no_tax_exclusive_info,Ceny nie obejmują podatków. Podatki będą obowiązywać zgodnie z datą i adresem rozliczeniowym w momencie wystawienia faktury.,Prices are not inclusive of taxes. Taxes will be applicable as per billing date and address at the time of invoicing.,Disclaimer when taxes are not shown but applicable when invocing
quotes.tax_details.show_tax.inclusive_info,"Należy pamiętać, że obowiązujące podatki mogą ulec zmianie w zależności od daty i adresu rozliczenia w momencie wystawiania faktury.",Please note that taxes applicable may change based on billing date and address at the time of invoicing.,Disclaimer message shown in tax details when taxes are added in quote in inclusive mode
